index,Source,Brand,Campaign,Review,Refined_Review,Polarity_Vader
105,Twitter,Hector,ItsAHumanThing,"#MGHector #Cars 
MG Motor India has raised Hector and Hector Plus SUVs prices for the third time this year due to i… https://t.co/UvsEYAEHAB","   Cars 
  Motor   has raised   and   Plus SUVs prices for the third time this year due to i httpstcoUvsEYAEHAB",0
106,Twitter,Hector,ItsAHumanThing,We concluded the weekend with a blast when this Crystal Black MG Hector PLUS drove in for a 9H Ceramic Coating pain… https://t.co/YogWR10Y5s,We concluded the weekend with a blast when this       PLUS drove in for a 9H Ceramic Coating pain httpstcoYogWR10Y5s,-1
107,Twitter,Hector,ItsAHumanThing,@hormazdsorabjee When cars like Toyota didn’t upgrade their Innova.. what a scope it gave many players to dominate #mghector  #hyundai #kia,hormazdsorabjee When cars like   didnt upgrade their Innova what a scope it gave many players to dominate mghector  hyundai kia,-1
108,Twitter,Hector,ItsAHumanThing,"This Easter, let there be hope, peace and love. The MG family, wishes you all a very happy and blessed Easter.… https://t.co/KNN1cotEzB",This Easter let there be hope peace and love The   family wishes you all a very happy and blessed Easter httpstcoKNN1cotEzB,1
109,Twitter,Hector,ItsAHumanThing,"माझ्या #MGHector ला नाव ठेवायच नाही👊

#लाडका आणि ती, या दोनच गोष्टी मला #मनसे आवडतात😇 https://t.co/atvJT9tkdX","मझय    ल नव ठवयच नह

लडक आण त य दनच गषट मल मनस आवडतत httpstcoatvJT9tkdX",0
110,Twitter,Hector,ItsAHumanThing,Auto-updates daily Ep-35 is Live on the YouTube channel of Motoro-updates click here to watch:… https://t.co/2nAQU0ylSM,Autoupdates daily Ep35 is   on the   channel of Motoroupdates click here to watch httpstco2nAQU0ylSM,0
111,Twitter,Hector,ItsAHumanThing,"The Innova Crysta has been in the game since long. But with MG pushing out it's Hector Plus, the veteran is in for… https://t.co/xg2rkccJ6d",The   has been in the game since long But with   pushing out its   Plus the veteran is in for httpstcoxg2rkccJ6d,0
112,Twitter,Hector,ItsAHumanThing,It turns out that March 2021 was a bright period for the sales of #MGHector in #India. So how was that?… https://t.co/pq0y8g8nGK,It turns out that March 2021 was a bright period for the sales of    in   So how was that httpstcopq0y8g8nGK,1
113,Twitter,Hector,ItsAHumanThing,@anandmahindra @bhash It should be in category of Jeeps....for sedan car category it always #HondaCity...In FULL FL… https://t.co/dwEiuycmvH,anandmahindra bhash It should be in category of Jeepsfor sedan car category it always  In   FL httpstcodwEiuycmvH,0
114,Twitter,Hector,ItsAHumanThing,Volkswagen Taigun Compact SUV’s production version leaked ahead of official reveal - https://t.co/DAcIIUP7Cr… https://t.co/8bIvxzE6FN,  SUVs production version leaked ahead of official reveal  httpstcoDAcIIUP7Cr httpstco8bIvxzE6FN,-1
